<?xml version="1.0" encoding="UTF-8"?>
<module xmlns:xsi="http://www.w3.org/2001/XMLSchema-instance" xsi:noNamespaceSchemaLocation="../settings.xsd">
  <name>Statistics</name>
  <author>Youconix</author>
  <description>Statistics module for the framework Miniature-happiness</description>
  <version>1.0</version>
  <install>install.php</install>
  <upgrade></upgrade>
  <deinstall>deinstall.php</deinstall>
  <title>system/menu/statistics</title>
  <css>statistics.css</css>
  <block>
    <title>system/admin/statistics/settings</title>
    <id>admin_statistics_settings</id>
    <path>admin_statistics_settings</path>
  </block>
  <block>
    <title>system/admin/statistics/visitors</title>
    <id>admin_statistics_visitors</id>
    <path>admin_statistics_visitors</path>
  </block>
  <block>
    <title>system/admin/statistics/visitors_hours</title>
    <id>admin_statistics_visitors_hours</id>
    <path>admin_statistics_visitors_hour</path>
  </block>
  <block>
    <title>system/admin/statistics/os</title>
    <id>admin_statistics_os</id>
    <path>admin_statistics_os</path>
  </block>
  <block>
    <title>system/admin/statistics/browsers</title>
    <id>admin_statistics_browsers</id>
    <path>admin_statistics_browsers</path>
  </block>
  <block>
    <title>system/admin/statistics/screen_colors</title>
    <id>admin_statistics_screen_colors</id>
    <path>admin_statistics_colors</path>
  </block>
  <block>
    <title>system/admin/statistics/screen_sizes</title>
    <id>admin_statistics_screen_sizes</id>
    <path>admin_statistics_sizes</path>
  </block>
  <block>
    <title>system/admin/statistics/references</title>
    <id>admin_statistics_references</id>
    <path>admin_statistics_references</path>
  </block>
  <block>
    <title>system/admin/statistics/pages</title>
    <id>admin_statistics_pages</id>
    <path>admin_statistics_pages</path>
  </block>
</module>
